{
  "carry_forward": true,
  "cases": [
    {
      "audit_status": "PASS",
      "case_sha256": "5f57f7b095e2563bdfe60e10e6a808433a09811b55752bd32aaf7cf79b001eb8",
      "expected_primary_signal": null,
      "fault_id": null,
      "kind": "clean_control",
      "observed_primary_signal": null,
      "observed_signal_ids": [],
      "primary_expectation_met": true,
      "seed": 4100
    },
    {
      "audit_status": "FAIL",
      "case_sha256": "8c8e6297ef27bb9f5125037ba7f3eea04794bdc14ef2168404b008b53b4dcbff",
      "expected_primary_signal": "invalid_role",
      "fault_id": "schema.invalid_role",
      "kind": "fault",
      "observed_primary_signal": "invalid_role",
      "observed_signal_ids": [
        "invalid_role",
        "role_order"
      ],
      "primary_expectation_met": true,
      "seed": 4100
    },
    {
      "audit_status": "FAIL",
      "case_sha256": "a7de518da70ae0f64ee7d96fcc3552a6a6945bd011024e0c25335fae67b4bbb3",
      "expected_primary_signal": "role_order",
      "fault_id": "schema.role_order",
      "kind": "fault",
      "observed_primary_signal": "role_order",
      "observed_signal_ids": [
        "role_order"
      ],
      "primary_expectation_met": true,
      "seed": 4100
    },
    {
      "audit_status": "FAIL",
      "case_sha256": "0597243d651815b44146970c3dc9744c5a43fd11c98aeb3d39a26fce9f5b3531",
      "expected_primary_signal": "missing_eos",
      "fault_id": "template.missing_eos",
      "kind": "fault",
      "observed_primary_signal": "missing_eos",
      "observed_signal_ids": [
        "missing_eos"
      ],
      "primary_expectation_met": true,
      "seed": 4100
    },
    {
      "audit_status": "FAIL",
      "case_sha256": "4ad0fcdb6576067ffdfe1d4b0216a2a58dff462bcc251edb496e07ddffb8ba95",
      "expected_primary_signal": "prompt_token_supervised",
      "fault_id": "mask.prompt_supervised",
      "kind": "fault",
      "observed_primary_signal": "prompt_token_supervised",
      "observed_signal_ids": [
        "prompt_token_supervised"
      ],
      "primary_expectation_met": true,
      "seed": 4100
    },
    {
      "audit_status": "FAIL",
      "case_sha256": "f986bc41a0b596c99c23127dd74dba3576fafad82fc021bf0e47ffe012724188",
      "expected_primary_signal": "assistant_fully_truncated",
      "fault_id": "truncation.answer_removed",
      "kind": "fault",
      "observed_primary_signal": "assistant_fully_truncated",
      "observed_signal_ids": [
        "assistant_fully_truncated"
      ],
      "primary_expectation_met": true,
      "seed": 4100
    },
    {
      "audit_status": "PASS",
      "case_sha256": "16a6b1085342447e14607a74f722fdc4a69d06a01843fb01938ecdef3a3fd8a1",
      "expected_primary_signal": "exact_duplicate",
      "fault_id": "data.exact_duplicate",
      "kind": "fault",
      "observed_primary_signal": "exact_duplicate",
      "observed_signal_ids": [
        "exact_duplicate"
      ],
      "primary_expectation_met": true,
      "seed": 4100
    },
    {
      "audit_status": "FAIL",
      "case_sha256": "042de45aa942895b11a6999a1df92ae7bf9a1e6c447cc0eccd32c67ee08dd8f0",
      "expected_primary_signal": "prompt_conflict",
      "fault_id": "data.prompt_conflict",
      "kind": "fault",
      "observed_primary_signal": "prompt_conflict",
      "observed_signal_ids": [
        "prompt_conflict"
      ],
      "primary_expectation_met": true,
      "seed": 4100
    },
    {
      "audit_status": "FAIL",
      "case_sha256": "359feff53fd877e5fd246484a82239cc64908dffd028f8294eed53122f7b20d4",
      "expected_primary_signal": "train_eval_leakage",
      "fault_id": "data.train_eval_leakage",
      "kind": "fault",
      "observed_primary_signal": "train_eval_leakage",
      "observed_signal_ids": [
        "train_eval_leakage"
      ],
      "primary_expectation_met": true,
      "seed": 4100
    },
    {
      "audit_status": "FAIL",
      "case_sha256": "f56ba366d44170e2e7019bc90c2de2501b803756b356f5f14c2668c2d4ffc0ac",
      "expected_primary_signal": "secret_pattern",
      "fault_id": "privacy.secret_pattern",
      "kind": "fault",
      "observed_primary_signal": "secret_pattern",
      "observed_signal_ids": [
        "pii_like",
        "secret_pattern"
      ],
      "primary_expectation_met": true,
      "seed": 4100
    },
    {
      "audit_status": "PASS",
      "case_sha256": "120af0f7bef4f9f196721ec14a55a10cc8878a89c73d4e89386eec45d96b8103",
      "expected_primary_signal": null,
      "fault_id": null,
      "kind": "clean_control",
      "observed_primary_signal": null,
      "observed_signal_ids": [],
      "primary_expectation_met": true,
      "seed": 4101
    },
    {
      "audit_status": "FAIL",
      "case_sha256": "acb5d289c02e4f9a2ae791b163ee53f4b8821ded0cbb5658626e13bf98061585",
      "expected_primary_signal": "invalid_role",
      "fault_id": "schema.invalid_role",
      "kind": "fault",
      "observed_primary_signal": "invalid_role",
      "observed_signal_ids": [
        "invalid_role",
        "role_order"
      ],
      "primary_expectation_met": true,
      "seed": 4101
    },
    {
      "audit_status": "FAIL",
      "case_sha256": "3fd48a916b7961f34b8e799f28ba46f3f549c670dbaba442030db61391b12395",
      "expected_primary_signal": "role_order",
      "fault_id": "schema.role_order",
      "kind": "fault",
      "observed_primary_signal": "role_order",
      "observed_signal_ids": [
        "role_order"
      ],
      "primary_expectation_met": true,
      "seed": 4101
    },
    {
      "audit_status": "FAIL",
      "case_sha256": "36bb69f44f76c9f41ade010d997058efde81854cb1a942f6d2901e25c3ffc28b",
      "expected_primary_signal": "missing_eos",
      "fault_id": "template.missing_eos",
      "kind": "fault",
      "observed_primary_signal": "missing_eos",
      "observed_signal_ids": [
        "missing_eos"
      ],
      "primary_expectation_met": true,
      "seed": 4101
    },
    {
      "audit_status": "FAIL",
      "case_sha256": "b61e7a38c7c46599e4ce106fb6dfd06dc26b057299561a59873b892679315747",
      "expected_primary_signal": "prompt_token_supervised",
      "fault_id": "mask.prompt_supervised",
      "kind": "fault",
      "observed_primary_signal": "prompt_token_supervised",
      "observed_signal_ids": [
        "prompt_token_supervised"
      ],
      "primary_expectation_met": true,
      "seed": 4101
    },
    {
      "audit_status": "FAIL",
      "case_sha256": "775dd68b9272d1179f575b239c41b1881d58011ac0cbaefb0e135a499bae55c4",
      "expected_primary_signal": "assistant_fully_truncated",
      "fault_id": "truncation.answer_removed",
      "kind": "fault",
      "observed_primary_signal": "assistant_fully_truncated",
      "observed_signal_ids": [
        "assistant_fully_truncated"
      ],
      "primary_expectation_met": true,
      "seed": 4101
    },
    {
      "audit_status": "PASS",
      "case_sha256": "c23421a5aba39766532f9f64bea5cd28b85ac42b2b2dcee22904cca34c9d8c19",
      "expected_primary_signal": "exact_duplicate",
      "fault_id": "data.exact_duplicate",
      "kind": "fault",
      "observed_primary_signal": "exact_duplicate",
      "observed_signal_ids": [
        "exact_duplicate"
      ],
      "primary_expectation_met": true,
      "seed": 4101
    },
    {
      "audit_status": "FAIL",
      "case_sha256": "8f78488a8cbd048f3ad41be28707a60717270620ba896cdfd1073ea937983066",
      "expected_primary_signal": "prompt_conflict",
      "fault_id": "data.prompt_conflict",
      "kind": "fault",
      "observed_primary_signal": "prompt_conflict",
      "observed_signal_ids": [
        "prompt_conflict"
      ],
      "primary_expectation_met": true,
      "seed": 4101
    },
    {
      "audit_status": "FAIL",
      "case_sha256": "b66cfe8ff43543ddc543ae2ca5074fd634b0ac889debcff1270a13f30d4e1eeb",
      "expected_primary_signal": "train_eval_leakage",
      "fault_id": "data.train_eval_leakage",
      "kind": "fault",
      "observed_primary_signal": "train_eval_leakage",
      "observed_signal_ids": [
        "train_eval_leakage"
      ],
      "primary_expectation_met": true,
      "seed": 4101
    },
    {
      "audit_status": "FAIL",
      "case_sha256": "0730548b36ad1704412297fdb158b51c39ded538bfae2a69c74343c68e5469d2",
      "expected_primary_signal": "secret_pattern",
      "fault_id": "privacy.secret_pattern",
      "kind": "fault",
      "observed_primary_signal": "secret_pattern",
      "observed_signal_ids": [
        "secret_pattern"
      ],
      "primary_expectation_met": true,
      "seed": 4101
    },
    {
      "audit_status": "PASS",
      "case_sha256": "f31c71167af0fd046d6c777ede394ab3db0d1adbe54d53d3ca4a450fffb421c7",
      "expected_primary_signal": null,
      "fault_id": null,
      "kind": "clean_control",
      "observed_primary_signal": null,
      "observed_signal_ids": [],
      "primary_expectation_met": true,
      "seed": 4102
    },
    {
      "audit_status": "FAIL",
      "case_sha256": "b1d213d79e5af97317cc8837a2739aaf308511dfc0269c209806850212fbe141",
      "expected_primary_signal": "invalid_role",
      "fault_id": "schema.invalid_role",
      "kind": "fault",
      "observed_primary_signal": "invalid_role",
      "observed_signal_ids": [
        "invalid_role",
        "role_order"
      ],
      "primary_expectation_met": true,
      "seed": 4102
    },
    {
      "audit_status": "FAIL",
      "case_sha256": "367a5991a0512eb801b5a6d6571f7e2f2e9e01aed81172d89f00c7cbc44fbedd",
      "expected_primary_signal": "role_order",
      "fault_id": "schema.role_order",
      "kind": "fault",
      "observed_primary_signal": "role_order",
      "observed_signal_ids": [
        "role_order"
      ],
      "primary_expectation_met": true,
      "seed": 4102
    },
    {
      "audit_status": "FAIL",
      "case_sha256": "453e63e7af0b039c0a8b3ff01f1e8cd5041ca7fac7d215d8638ef4c9d3671f48",
      "expected_primary_signal": "missing_eos",
      "fault_id": "template.missing_eos",
      "kind": "fault",